{
  "schema_version": "1.5",
  "project_id": "SAMPLE",
  "processes": [
    {
      "id": "PROC-001",
      "title": "Password reset through the help desk",
      "perspective": "as_is",
      "actors": "Registered user; help-desk agent",
      "trigger": "The user cannot sign in and phones the help desk",
      "preconditions": "The user can prove their identity to the agent",
      "main_flow": [
        "The user phones the help desk.",
        "The agent verifies the user's identity.",
        "The agent sets a temporary password."
      ],
      "alternative_flows": [
        "None observed."
      ],
      "exceptions": [
        "Identity cannot be verified: the call ends without a reset."
      ],
      "result": "The agent sets a temporary password and reads it to the user",
      "business_rules": [],
      "data_involved": [
        "ENT-001"
      ],
      "related_requirements": [
        "BR-001"
      ],
      "compares_to": null,
      "differences": [],
      "confidence": "confirmed",
      "source_path": "specification/process-model.md"
    },
    {
      "id": "PROC-002",
      "title": "Self-service password reset",
      "perspective": "to_be",
      "actors": "Registered user",
      "trigger": "The user asks to reset a forgotten password",
      "preconditions": "The user can read email at the account's address",
      "main_flow": [
        "The user enters their email address (FR-AUTH-001).",
        "The system issues a reset token and sends the link (FR-AUTH-001, SR-001).",
        "The user opens the link and sets a new password (FR-AUTH-002)."
      ],
      "alternative_flows": [
        "The address has no active account: the same response is shown and no email is sent."
      ],
      "exceptions": [
        "The link is expired or used: it is rejected and the password is unchanged (RULE-001)."
      ],
      "result": "The user signs in with a new password they chose",
      "business_rules": [
        "RULE-001"
      ],
      "data_involved": [
        "ENT-001",
        "ENT-002"
      ],
      "related_requirements": [
        "BR-001",
        "FR-AUTH-001",
        "FR-AUTH-002",
        "SR-001"
      ],
      "compares_to": "PROC-001",
      "differences": [
        "No help-desk agent is involved.",
        "The user chooses the new password; no temporary password is read out."
      ],
      "confidence": "confirmed",
      "source_path": "specification/process-model.md"
    }
  ],
  "entities": [
    {
      "id": "ENT-001",
      "name": "Account",
      "purpose": "A registered user's access to the portal",
      "key_attributes": [
        "Email address",
        "Password (never stored in plain text)",
        "State"
      ],
      "relationships": [
        "Has zero or more reset tokens (ENT-002)"
      ],
      "states": [
        "ACTIVE",
        "INACTIVE"
      ],
      "owner": "MOD-001 Authentication",
      "permissions": "Only the account holder can change its password",
      "business_rules": [],
      "related_requirements": [
        "FR-AUTH-001",
        "FR-AUTH-002"
      ],
      "confidence": "confirmed",
      "source_path": "specification/domain-model.md"
    },
    {
      "id": "ENT-002",
      "name": "Reset token",
      "purpose": "Proof that a reset was requested for an account",
      "key_attributes": [
        "Token hash",
        "Issue time",
        "Used flag"
      ],
      "relationships": [
        "Belongs to exactly one account (ENT-001)"
      ],
      "states": [
        "ISSUED",
        "USED",
        "EXPIRED"
      ],
      "owner": "MOD-001 Authentication",
      "permissions": "Created by the system; redeemed only by the holder of the link",
      "business_rules": [
        "RULE-001"
      ],
      "related_requirements": [
        "FR-AUTH-001",
        "FR-AUTH-002",
        "SR-001"
      ],
      "confidence": "confirmed",
      "source_path": "specification/domain-model.md"
    }
  ]
}
